{
  "artifact_sources": [
    {
      "path": "experiments/eve/scripts/evaluate_stage2_entry_game.py",
      "sha256": "7dd10441541593ea63d9de70595b786e130a67327a33c8d6cf4c91d63d6c256f"
    },
    {
      "path": "experiments/eve/scripts/evaluator_common.py",
      "sha256": "4d3d51d21b08e8a49554e476d5782b424575d80d4c57616eb319789a9514cfa4"
    },
    {
      "path": "experiments/eve/stage2_entry_game/direct/case.json",
      "sha256": "7de31d85c925ed4e5d0128f8ad1cbc557b893c1b00a369ba3b6148937202597c"
    },
    {
      "path": "experiments/eve/stage2_entry_game/mutations.json",
      "sha256": "bf5cce8e4058e8bc305a401121523a4f9267f018e4749dfbb18ca070e0ea8e43"
    },
    {
      "path": "experiments/eve/stage2_entry_game/transport/case.json",
      "sha256": "31f28e01ece383775832f3b5aa0dd4a3a6488dc6338d6d7feaee07a4be875850"
    },
    {
      "path": "experiments/eve/stage3_review/review-record.json",
      "sha256": "6137c65f4681a2efc50bc9b6665c89b193e6751795c25a557af2c7f50b1d19ea"
    },
    {
      "path": "experiments/eve/stage3_review/rubric.json",
      "sha256": "850500f10be16916974590907313be3f3f1dad3c68296da800393b5697b6e177"
    }
  ],
  "criteria": [
    {
      "applies_when": "all",
      "criterion_id": "CORE.SOURCE_LOCK",
      "description": "The frozen public source and case contracts retain their recorded identity.",
      "evidence_sources": ["case-contract", "seed-candidate-sha256"],
      "evidence_strength": "deterministic_contract",
      "kind": "hard_mirror",
      "name_en": "Source lock",
      "name_zh": "来源锁定",
      "prerequisites": ["CORE.EDIT_BOUNDARY", "CORE.PROTECTED_ASSETS_INITIAL"],
      "protected": true,
      "scope": "Stage 2 common hard gate",
      "score_role": "fatal",
      "severity": "P1"
    },
    {
      "applies_when": "all",
      "criterion_id": "CORE.EDIT_BOUNDARY",
      "description": "Only Candidate.lean may differ from the route seed tree.",
      "evidence_sources": ["hard-oracle:gates.boundary"],
      "evidence_strength": "deterministic_contract",
      "kind": "hard_mirror",
      "name_en": "Edit boundary",
      "name_zh": "编辑边界",
      "prerequisites": ["CORE.PROTECTED_ASSETS_INITIAL"],
      "protected": true,
      "scope": "Stage 2 common hard gate",
      "score_role": "fatal",
      "severity": "P1"
    },
    {
      "applies_when": "all",
      "criterion_id": "CORE.PROTECTED_ASSETS_INITIAL",
      "description": "Protected evaluator, case, seed, task, and Lean assets match before evaluation.",
      "evidence_sources": ["hard-oracle:gates.protected_assets_initial"],
      "evidence_strength": "deterministic_contract",
      "kind": "hard_mirror",
      "name_en": "Initial protected assets",
      "name_zh": "初始受保护资产",
      "prerequisites": [],
      "protected": true,
      "scope": "Stage 2 common hard gate",
      "score_role": "fatal",
      "severity": "P1"
    },
    {
      "applies_when": "all",
      "criterion_id": "CORE.IMPORT_BOUNDARY",
      "description": "The candidate has exactly the frozen import allowlist.",
      "evidence_sources": ["hard-oracle:gates.import_allowlist"],
      "evidence_strength": "deterministic_static",
      "kind": "hard_mirror",
      "name_en": "Import boundary",
      "name_zh": "导入边界",
      "prerequisites": ["CORE.SOURCE_LOCK"],
      "protected": true,
      "scope": "Stage 2 common hard gate",
      "score_role": "frontier",
      "severity": "P1"
    },
    {
      "applies_when": "all",
      "criterion_id": "CORE.TASK_IDENTITY",
      "description": "The protected task prefix retains the exact frozen hash.",
      "evidence_sources": ["hard-oracle:gates.task_prefix"],
      "evidence_strength": "deterministic_contract",
      "kind": "hard_mirror",
      "name_en": "Task identity",
      "name_zh": "任务身份",
      "prerequisites": ["CORE.IMPORT_BOUNDARY"],
      "protected": true,
      "scope": "Stage 2 common hard gate",
      "score_role": "fatal",
      "severity": "P1"
    },
    {
      "applies_when": "all",
      "criterion_id": "CORE.NO_PLACEHOLDER",
      "description": "The audited static guard accepts the candidate without placeholders or forbidden declarations.",
      "evidence_sources": ["hard-oracle:gates.static_guard"],
      "evidence_strength": "deterministic_static",
      "kind": "hard_mirror",
      "name_en": "No placeholder",
      "name_zh": "无占位证明",
      "prerequisites": ["CORE.TASK_IDENTITY"],
      "protected": true,
      "scope": "Stage 2 common hard gate",
      "score_role": "fatal",
      "severity": "P1"
    },
    {
      "applies_when": "all",
      "criterion_id": "CORE.NO_TRUSTED_BYPASS",
      "description": "No unsafe, opaque, extern, run_tac, #eval, or implemented_by bypass is present.",
      "evidence_sources": ["hard-oracle:gates.trusted_bypass_guard"],
      "evidence_strength": "deterministic_static",
      "kind": "hard_mirror",
      "name_en": "No trusted bypass",
      "name_zh": "无可信绕过",
      "prerequisites": ["CORE.TASK_IDENTITY"],
      "protected": true,
      "scope": "Stage 2 common hard gate",
      "score_role": "fatal",
      "severity": "P1"
    },
    {
      "applies_when": "all",
      "criterion_id": "CORE.ROUTE_IDENTITY",
      "description": "The candidate satisfies the frozen route-discipline structure check.",
      "evidence_sources": ["hard-oracle:gates.route_discipline"],
      "evidence_strength": "syntactic_only",
      "kind": "hard_mirror",
      "name_en": "Route identity",
      "name_zh": "证明路线身份",
      "prerequisites": ["CORE.NO_PLACEHOLDER", "CORE.NO_TRUSTED_BYPASS"],
      "protected": true,
      "scope": "Stage 2 common hard gate",
      "score_role": "fatal",
      "severity": "P1"
    },
    {
      "applies_when": "all",
      "criterion_id": "CORE.ENVIRONMENT",
      "description": "Lean, Mathlib, and toolchain identities match the frozen case contract.",
      "evidence_sources": ["hard-oracle:gates.environment"],
      "evidence_strength": "deterministic_contract",
      "kind": "hard_mirror",
      "name_en": "Environment",
      "name_zh": "环境身份",
      "prerequisites": ["CORE.ROUTE_IDENTITY"],
      "protected": true,
      "scope": "Stage 2 common hard gate",
      "score_role": "frontier",
      "severity": "P2"
    },
    {
      "applies_when": "all",
      "criterion_id": "CORE.COMPILATION",
      "description": "The candidate elaborates under the frozen Lean environment.",
      "evidence_sources": ["hard-oracle:gates.compile"],
      "evidence_strength": "lean_kernel",
      "kind": "hard_mirror",
      "name_en": "Compilation",
      "name_zh": "候选编译",
      "prerequisites": ["CORE.ENVIRONMENT"],
      "protected": true,
      "scope": "Stage 2 common hard gate",
      "score_role": "frontier",
      "severity": "P2"
    },
    {
      "applies_when": "all",
      "criterion_id": "CORE.WARNING_POLICY",
      "description": "Candidate and route-contract elaboration produce no warnings.",
      "evidence_sources": ["hard-oracle:gates.warning_policy"],
      "evidence_strength": "deterministic_contract",
      "kind": "hard_mirror",
      "name_en": "Warning policy",
      "name_zh": "警告策略",
      "prerequisites": ["CORE.TARGET_DECLARATIONS"],
      "protected": true,
      "scope": "Stage 2 common hard gate",
      "score_role": "frontier",
      "severity": "P2"
    },
    {
      "applies_when": "all",
      "criterion_id": "CORE.TARGET_DECLARATIONS",
      "description": "The route contract elaborates against the exact exercise-facing declarations.",
      "evidence_sources": ["hard-oracle:gates.target_declarations"],
      "evidence_strength": "lean_kernel",
      "kind": "hard_mirror",
      "name_en": "Target declarations",
      "name_zh": "目标声明契约",
      "prerequisites": ["CORE.COMPILATION"],
      "protected": true,
      "scope": "Stage 2 common hard gate",
      "score_role": "frontier",
      "severity": "P2"
    },
    {
      "applies_when": "all",
      "criterion_id": "CORE.AXIOM_ALLOWLIST",
      "description": "Observed target axioms remain within the frozen Lean foundation allowlist.",
      "evidence_sources": ["hard-oracle:gates.axiom_allowlist"],
      "evidence_strength": "lean_kernel",
      "kind": "hard_mirror",
      "name_en": "Axiom allowlist",
      "name_zh": "公理允许列表",
      "prerequisites": ["CORE.WARNING_POLICY"],
      "protected": true,
      "scope": "Stage 2 common hard gate",
      "score_role": "frontier",
      "severity": "P1"
    },
    {
      "applies_when": "all",
      "criterion_id": "CORE.PROTECTED_ASSETS_FINAL",
      "description": "Protected evaluator assets remain unchanged after every evaluator return path.",
      "evidence_sources": ["hard-oracle:gates.protected_assets_final"],
      "evidence_strength": "deterministic_contract",
      "kind": "hard_mirror",
      "name_en": "Final protected assets",
      "name_zh": "最终受保护资产",
      "prerequisites": [],
      "protected": true,
      "scope": "Stage 2 common hard gate",
      "score_role": "fatal",
      "severity": "P1"
    },
    {
      "applies_when": "direct",
      "criterion_id": "DIRECT.CONCRETE_ROUTE",
      "description": "The direct route remains a concrete payoff-table proof route.",
      "evidence_sources": ["hard-oracle:gates.route_discipline"],
      "evidence_strength": "deterministic_static",
      "kind": "semantic_progress",
      "name_en": "Concrete route",
      "name_zh": "具体证明路线",
      "prerequisites": ["CORE.ROUTE_IDENTITY"],
      "protected": true,
      "scope": "Stage 2 direct route",
      "score_role": "diagnostic_only",
      "severity": "P1"
    },
    {
      "applies_when": "direct",
      "criterion_id": "DIRECT.NASH_CHARACTERIZATION",
      "description": "The exact concrete Nash characterization theorem elaborates.",
      "evidence_sources": ["hard-oracle:route-contract"],
      "evidence_strength": "lean_kernel",
      "kind": "semantic_progress",
      "name_en": "Nash characterization",
      "name_zh": "纳什均衡刻画",